<!ELEMENT inventario (item+)>
<!ELEMENT item (nombre, precio, stock)>
<!ATTLIST item sku CDATA #REQUIRED moneda (EUR|USD) "EUR">
<!ELEMENT nombre (#PCDATA)>
<!ELEMENT precio (#PCDATA)>
<!ELEMENT stock (#PCDATA)>